{
  "comment": "CANDIDATE, NOT REGISTERED. Gold answer to be authored by Annotator A. Empty fields are deliberate; see candidates/README.md.",
  "review_context": {
    "party": "Purchaser (Tessarine Capital Partners IV SCSp)",
    "governing_law": "Germany",
    "objective": "Buy-side first-pass review of a seller-friendly SPA draft.",
    "risk_appetite": ""
  },
  "clause_types": [],
  "risk_flags": {},
  "severity_rationale": {},
  "clause_aliases": {},
  "clause_anchors": {}
}