{
  "comment": "Human-authored gold answer for the synthetic SaaS agreement. severity_rationale records why each flag carries its severity. Service levels, data protection and term are deliberately clean: a reviewer who flags them is producing false positives. clause_aliases declares synonyms for the SAME clause of the SAME document — spelling, plural and hyphenation variants, or an equally accurate name. Scoring a correct review as a miss because it wrote 'no_licence' for 'no_license' measures vocabulary, not legal judgment. An alias never maps onto a different clause.",
  "review_context": {
    "party": "Customer (Northwind Materials GmbH)",
    "governing_law": "Germany",
    "objective": "Pre-signature review of a vendor paper contract for a business-critical system.",
    "risk_appetite": "conservative"
  },
  "clause_types": [
    "service_levels",
    "data_protection",
    "limitation_of_liability",
    "term",
    "auto_renewal",
    "subprocessors",
    "security",
    "ip_and_model_training",
    "indemnity",
    "fees",
    "data_export_on_termination"
  ],
  "risk_flags": {
    "auto_renewal": "high",
    "ip_and_model_training": "high",
    "indemnity": "high",
    "fees": "high",
    "subprocessors": "high",
    "limitation_of_liability": "medium",
    "security": "medium",
    "data_export_on_termination": "medium"
  },
  "severity_rationale": {
    "auto_renewal": "high — a ninety day notice window against a twelve month term means the decision point falls at month nine, and a single missed date commits the customer to another full year.",
    "ip_and_model_training": "high — a perpetual irrevocable licence to train models on Customer Data expressly including Customer Personal Data has no lawful basis under the data protection clause in section 2, which limits processing to documented instructions. The two clauses contradict each other, and this one would make the provider a controller for that processing.",
    "indemnity": "high — the customer indemnifying the provider against third-party claims that the provider's own service infringes reverses the normal allocation. The party that built the service and can clear the rights bears none of the risk.",
    "fees": "high — an uncapped increase at any time on thirty days notice with no corresponding termination right is a unilateral right to reprice a locked-in customer.",
    "subprocessors": "high — appointing sub-processors with website publication and no notice gives the customer no opportunity to object and does not meet Art. 28(2) GDPR, which the data protection clause purports to comply with. EDPB Opinion 22/2024 (adopted 7 October 2024), para. 27, reads a general authorisation as requiring the processor to offer a list of sub-processors for approval at signature and to flag later changes actively, with a sufficient timeframe to object; publication on a website with no notice does neither.",
    "limitation_of_liability": "medium — a twelve month fee cap is common market practice, but it carves out nothing for data breach, confidentiality or IP indemnity, which is worse than market and should be negotiated.",
    "security": "medium — 'industry standard measures appropriate to a provider of its size' is unmeasurable and gives the customer nothing to audit against, but it is a drafting weakness rather than an absent obligation.",
    "data_export_on_termination": "medium — a seven day deletion window with export only on request risks irreversible data loss on a missed deadline. For a data processing service within Art. 2(8) of Regulation (EU) 2023/2854, Art. 25(2)(g) requires a minimum data retrieval period of at least 30 calendar days after the transitional period and Art. 25(2)(h) permits erasure only after it, so thirty days with a standing export right is the statutory floor as well as the ordinary position; a term below it should be negotiated up rather than accepted. Art. 31(1) lifts only Art. 23(d), Art. 29 and Art. 30(1) and (3) for a service whose main features have mostly been custom-built for an individual customer and which is not offered at broad commercial scale through the provider's service catalogue, so the retrieval period binds such a service too; only a non-production version provided for testing and evaluation for a limited period falls outside Chapter VI (Art. 31(2))."
  },
  "clause_aliases": {
    "service_level_agreement": "service_levels",
    "service_level": "service_levels",
    "uptime": "service_levels",
    "sub_processors": "subprocessors",
    "sub_processing": "subprocessors",
    "intellectual_property": "ip_and_model_training",
    "intellectual_property_and_service_improvement": "ip_and_model_training",
    "model_training": "ip_and_model_training",
    "security_measures": "security",
    "indemnification": "indemnity",
    "fees_and_charges": "fees",
    "data_export": "data_export_on_termination",
    "deletion_and_export": "data_export_on_termination"
  },
  "clause_anchors": {
    "service_levels": "commercially reasonable efforts to maintain 99.5% monthly",
    "data_protection": "process Customer Personal Data only on documented instructions",
    "limitation_of_liability": "shall not exceed the fees paid",
    "term": "initial term of this Agreement is twelve (12) months",
    "auto_renewal": "renews automatically for successive twelve (12) month terms",
    "subprocessors": "may appoint sub-processors to process Customer Personal Data",
    "security": "industry standard security measures appropriate to a provider",
    "ip_and_model_training": "perpetual, irrevocable, worldwide licence",
    "indemnity": "indemnify and hold harmless the Provider",
    "fees": "may increase the fees at any time on thirty (30) days written notice",
    "data_export_on_termination": "delete all Customer Data seven (7) days after termination"
  }
}
