{
  "comment": "Human-authored gold answer for the synthetic Art. 28 GDPR data processing agreement. Clause types follow Art. 28(3) lit. a to h in the regulation's own order, plus Chapter V transfers and governing law. severity_rationale records why each flag carries its severity, so the calibration can be challenged rather than assumed. clause_aliases declares synonyms for the SAME clause of the SAME document — spelling, plural and hyphenation variants, or an equally accurate name. Scoring a correct review as a miss because it wrote 'no_licence' for 'no_license' measures vocabulary, not legal judgment. An alias never maps onto a different clause.",
  "review_context": {
    "party": "Controller (Northwind Materials GmbH)",
    "governing_law": "Germany, Regulation (EU) 2016/679",
    "objective": "Art. 28 GDPR compliance review before appointing the processor.",
    "risk_appetite": "conservative"
  },
  "clause_types": [
    "documented_instructions",
    "confidentiality",
    "security_measures",
    "subprocessor_authorization",
    "data_subject_rights_assistance",
    "breach_and_dpia_assistance",
    "deletion_return",
    "audit_rights",
    "international_transfers",
    "governing_law"
  ],
  "risk_flags": {
    "subprocessor_authorization": "high",
    "deletion_return": "high",
    "audit_rights": "high",
    "international_transfers": "high",
    "breach_and_dpia_assistance": "medium"
  },
  "severity_rationale": {
    "subprocessor_authorization": "high — Art. 28(3)(d) and Art. 28(2) require the controller's prior specific or general written authorisation. The clause appoints sub-processors at the processor's discretion and has the controller waive its right to object, which removes the authorisation entirely rather than channelling it. EDPB Opinion 22/2024 (adopted 7 October 2024), para. 27, confirms that even under a general authorisation the processor should let the controller approve a list of sub-processors at signature and give it a sufficient timeframe to object to later changes; a waiver of the right to object leaves nothing of that.",
    "deletion_return": "high — Art. 28(3)(g) requires deletion or return at the controller's choice at the end of the services. Indefinite retention for the processor's own purposes, including model training, converts the processor into a controller for that processing without a lawful basis.",
    "audit_rights": "high — Art. 28(3)(h) requires the processor to allow for and contribute to audits, including inspections, conducted by the controller or a mandated auditor. Certification-first audit regimes are ordinary market practice and would be medium; this clause expressly excludes inspections, which removes a mandatory element rather than channelling it.",
    "international_transfers": "high — Chapter V requires an adequacy decision or an Art. 46 safeguard to be in place before a transfer occurs. Permitting transfers now and addressing the mechanism 'if and when the need arises' inverts that sequence.",
    "breach_and_dpia_assistance": "medium — Art. 28(3)(f) and Art. 33(2) require notification without undue delay. A fourteen day window is materially worse than the controller's own 72 hour obligation can absorb and should be negotiated, but a reviewer who accepted it with reasons would not be negligent."
  },
  "clause_aliases": {
    "subject_matter_and_instructions": "documented_instructions",
    "processing_on_documented_instructions": "documented_instructions",
    "security_of_processing": "security_measures",
    "technical_and_organisational_measures": "security_measures",
    "sub_processors": "subprocessor_authorization",
    "subprocessors": "subprocessor_authorization",
    "assistance_data_subject_rights": "data_subject_rights_assistance",
    "data_subject_rights": "data_subject_rights_assistance",
    "personal_data_breach_notification": "breach_and_dpia_assistance",
    "breach_notification": "breach_and_dpia_assistance",
    "deletion_and_return": "deletion_return",
    "audits_and_inspections": "audit_rights",
    "audit": "audit_rights",
    "transfers": "international_transfers"
  },
  "clause_anchors": {
    "documented_instructions": "process personal data only on documented instructions from",
    "confidentiality": "committed themselves to confidentiality or are under an appropriate",
    "security_measures": "appropriate technical and organisational measures to ensure a level of security",
    "subprocessor_authorization": "engage sub-processors at its own discretion",
    "data_subject_rights_assistance": "rights laid down in Chapter III",
    "breach_and_dpia_assistance": "notify the Controller of a personal data breach",
    "deletion_return": "retain personal data for its own legitimate business purposes",
    "audit_rights": "On-site inspections and audits by the Controller",
    "international_transfers": "transfer personal data to its affiliates in third countries",
    "governing_law": "This DPA is governed by the laws of Germany"
  }
}
