{
  "comment": "Human-authored gold answer for the synthetic mutual NDA. Exception: the severity_rationale entries for term, permitted_disclosure, definition and notices were redrafted with AI assistance on 2026-10-13 and await the maintainer's adoption; see annotations/README.md. severity_rationale records why each flag carries its severity, so the calibration can be challenged rather than assumed. Sections 8, 9 and 11 are deliberately unremarkable: a reviewer who flags them is producing false positives. clause_aliases declares synonyms for the SAME clause of the SAME document — spelling, plural and hyphenation variants, or an equally accurate name. Scoring a correct review as a miss because it wrote 'no_licence' for 'no_license' measures vocabulary, not legal judgment. An alias never maps onto a different clause.",
  "review_context": {
    "party": "Disclosing Party (Northwind Materials GmbH)",
    "governing_law": "Germany",
    "objective": "Pre-signature review before disclosing technical information to a prospective supplier.",
    "risk_appetite": "conservative"
  },
  "clause_types": [
    "definition",
    "confidentiality",
    "term",
    "return_destruction",
    "governing_law",
    "permitted_disclosure",
    "residual_knowledge",
    "no_license",
    "injunctive_relief",
    "assignment",
    "notices"
  ],
  "risk_flags": {
    "term": "high",
    "residual_knowledge": "high",
    "permitted_disclosure": "high",
    "assignment": "high",
    "definition": "medium",
    "notices": "low"
  },
  "severity_rationale": {
    "term": "high — for the disclosing party the risk is that this protection may not hold, not that it is burdensome. German law does not make a perpetual confidentiality obligation unenforceable as such, but an obligation with no end, no survival period and no trade-secret distinction, attached to an all-information definition, is exposed to challenge, in particular if the discloser's own form counts as standard business terms, because the content review of standard terms protects the other party to the form, not the party that put it forward. If it falls, the discloser cannot be sure how long, or whether, contractual protection covers the technical information it is about to share, and a disclosure cannot be undone. A defined survival period, with protection for trade secrets for as long as they remain secret, is the more defensible position for the discloser.",
    "residual_knowledge": "high — an unaided-memory residuals clause that permits use for the benefit of third parties defeats the operative obligation in section 2. Whatever a person remembers may be used for a competitor, so the agreement protects only documents, not information.",
    "permitted_disclosure": "high — for the discloser this is weak protection at the point it matters. Whenever consent is withheld, the clause puts the receiving party between the agreement and a disclosure that law, a court or a regulator compels, so the discloser's control rests on a condition the other side cannot honour without disobeying that compulsion, and the clause gives the discloser no express right to cooperation in seeking protective relief. The standard position is notice where lawful and cooperation in seeking protective relief, not consent.",
    "assignment": "high — free assignment to a competitor of the disclosing party defeats the purpose of the agreement, since the counterparty can change to the one party the discloser would never have contracted with.",
    "definition": "medium — for the discloser, a definition covering all information whether or not marked confidential, without the standard public-domain, prior-possession and independent-development carve-outs, looks protective, but it invites a dispute over what was protected at all and adds to the exposure of the perpetual term it is paired with. Off-market and negotiable.",
    "notices": "low — email notice that takes effect when sent, not on receipt as § 130(1) BGB provides by default for a declaration to an absent party, puts the risk of a notice that is lost, filtered or undelivered on whichever party it is addressed to, the discloser included. Slightly off-market and worth a note, not a blocker."
  },
  "clause_aliases": {
    "definition_of_confidential_information": "definition",
    "confidential_information_definition": "definition",
    "confidentiality_obligations": "confidentiality",
    "return_or_destruction": "return_destruction",
    "return_and_destruction": "return_destruction",
    "permitted_disclosures": "permitted_disclosure",
    "required_disclosure": "permitted_disclosure",
    "no_licence": "no_license",
    "residuals": "residual_knowledge",
    "notice": "notices"
  },
  "clause_anchors": {
    "definition": "any and all information disclosed by either party",
    "confidentiality": "shall keep all Confidential Information secret",
    "term": "shall remain in effect in perpetuity",
    "return_destruction": "return or destroy all Confidential Information in its possession",
    "governing_law": "laws of the Federal Republic of Germany",
    "permitted_disclosure": "required by law, court order, or a competent regulatory authority",
    "residual_knowledge": "retained in the unaided memory of its personnel",
    "no_license": "grants the Receiving Party any licence or other right",
    "injunctive_relief": "damages may be an inadequate remedy for breach",
    "assignment": "including a competitor of the disclosing counterparty",
    "notices": "effective when sent by email to the address"
  }
}
